{
  "schema_version": 1,
  "run_id": "E20260914010000000000__s42__e76c1fcb__20260913T215932089199Z",
  "experiment_id": "E20260914010000000000",
  "status": "completed",
  "seed": 42,
  "evaluation_role": "selection",
  "primary_metric": {
    "name": "log_loss",
    "namespace": "validation",
    "direction": "minimize"
  },
  "summary": {
    "training_parameters": {
      "rank": 16.0,
      "alpha": 32.0,
      "dropout": 0.05,
      "learning_rate": 0.00028,
      "epochs": 3.0,
      "scheduler_horizon_epochs": 5.0,
      "seed": 42.0
    },
    "selection_validation": {
      "log_loss": 1.0150546817869401,
      "accuracy": 0.48746954403063003,
      "macro_f1": 0.4841961523147757,
      "ece_15": 0.015831790828040287,
      "brier_score": 0.6086397807564002,
      "swap_error_l1": 0.16376337184859657,
      "train_loss": 1.0225787010215615,
      "learning_rate": 0.00011916102841677942
    },
    "validation": {
      "log_loss": 1.0150546817869401,
      "accuracy": 0.48746954403063003,
      "macro_f1": 0.4841961523147757,
      "ece_15": 0.015831790828040287,
      "brier_score": 0.6086397807564002,
      "swap_error_l1": 0.16376337184859657,
      "train_runtime_seconds": 988.933120360598,
      "peak_gpu_memory_mb": 4249.52978515625,
      "runtime_seconds": 989.3303415793926
    }
  },
  "history": [
    {
      "namespace": "selection_validation",
      "step": 1,
      "metrics": {
        "log_loss": 1.081495886505958,
        "accuracy": 0.420292377305952,
        "macro_f1": 0.41731935105766116,
        "ece_15": 0.03831606045648662,
        "brier_score": 0.655090504620323,
        "swap_error_l1": 0.04328939323639715,
        "train_loss": 1.0899409529514645,
        "learning_rate": 0.00023832205683355884
      }
    },
    {
      "namespace": "selection_validation",
      "step": 2,
      "metrics": {
        "log_loss": 1.0354872161299051,
        "accuracy": 0.4629307344239471,
        "macro_f1": 0.4629244897912028,
        "ece_15": 0.017202718381865857,
        "brier_score": 0.6223884333998132,
        "swap_error_l1": 0.19290681004726798,
        "train_loss": 1.059698807131884,
        "learning_rate": 0.0001787415426251691
      }
    },
    {
      "namespace": "selection_validation",
      "step": 3,
      "metrics": {
        "log_loss": 1.0150546817869401,
        "accuracy": 0.48746954403063003,
        "macro_f1": 0.4841961523147757,
        "ece_15": 0.015831790828040287,
        "brier_score": 0.6086397807564002,
        "swap_error_l1": 0.16376337184859657,
        "train_loss": 1.0225787010215615,
        "learning_rate": 0.00011916102841677942
      }
    }
  ]
}
