{
  "schema_version": 1,
  "run_id": "E20260914081253343514__s20260903__89f05bda__20260914T083223713021Z",
  "experiment_id": "E20260914081253343514",
  "status": "completed",
  "seed": 20260903,
  "evaluation_role": "selection",
  "primary_metric": {
    "name": "log_loss",
    "namespace": "validation",
    "direction": "minimize"
  },
  "summary": {
    "train": {
      "train_loss": 1.1435056030750275
    },
    "validation": {
      "log_loss": 1.108489178764145,
      "accuracy": 0.40625,
      "macro_f1": 0.19259259259259257,
      "ece_15": 0.09129074372982403,
      "brier_score": 0.6750082848892623,
      "swap_error_l1": 5.701780202496676e-09,
      "runtime_seconds": 100.32601979997708
    }
  },
  "history": [
    {
      "namespace": "train",
      "step": 1,
      "metrics": {
        "train_loss": 1.1435056030750275
      }
    },
    {
      "namespace": "validation",
      "step": 1,
      "metrics": {
        "log_loss": 1.108489178764145,
        "accuracy": 0.40625,
        "macro_f1": 0.19259259259259257,
        "ece_15": 0.09129074372982403,
        "brier_score": 0.6750082848892623,
        "swap_error_l1": 5.701780202496676e-09
      }
    }
  ]
}