{
  "schema_version": 1,
  "run_id": "E002__s20260903__0894cdbc__20260905T000853164661Z",
  "experiment_id": "E002",
  "status": "completed",
  "seed": 20260903,
  "evaluation_role": "selection",
  "primary_metric": {
    "name": "log_loss",
    "namespace": "validation",
    "direction": "minimize"
  },
  "summary": {
    "validation": {
      "log_loss": 1.0630326821462381,
      "accuracy": 0.4469195962408632,
      "macro_f1": 0.44013726159212646,
      "ece_15": 0.026154015655685668,
      "brier_score": 0.6398066333597401,
      "swap_error_l1": 3.958177555634159e-05,
      "runtime_seconds": 68.32098775001941
    }
  },
  "history": []
}
